{
  "schemaVersion": "openacp-task-card.v1",
  "artifactType": "task-card",
  "taskId": "TASK-ISSUE-SPEC",
  "objective": "Write a starter workflow spec for local issue classification without external side effects.",
  "inputRefs": ["SRC-ISSUE-PRD"],
  "allowedScope": { "filesOrArtifacts": ["spec/**", "docs/**"], "effects": ["docs-only"] },
  "forbiddenScope": { "filesOrArtifacts": ["src/**", "package-lock.json"], "effects": ["external-side-effect", "dependency-change"], "claims": ["accepted", "merged", "released"] },
  "acceptanceCriteria": ["Workflow states input, classification output, draft output, and human review point.", "Outbound replies are forbidden."],
  "verificationPlan": [{ "check": "public scan", "method": "OpenACP validator public-package scan", "required": true }],
  "stopConditions": ["Real credentials are required.", "Posting or status changes are requested."],
  "expectedHandoff": { "artifactType": "handoff", "requiredFields": ["changedArtifacts", "verificationEvidence", "stateClaim"] },
  "authorityRequired": "B2",
  "authorityCharterRef": "authority-charter.json",
  "riskLevel": "low"
}
